{
  "$schema": "https://github.com/qwc-services/qwc-config-generator/raw/master/schemas/qwc-config-generator.json",
  "service": "config-generator",
  "config": {
    "tenant": "default",
    "default_qgis_server_url": "http://localhost:8088/ows/",
    "config_db_url": "postgresql:///?service=qwc_configdb",
    "permissions_default_allow": true,
    "qgis_projects_base_dir": "../qwc-docker/volumes/qgs-resources",
    "qgis_projects_scan_base_dir": "../qwc-docker/volumes/qgs-resources/scan",
    "qgis_projects_gen_base_dir": "../qwc-docker/volumes/qgs-resources/gen",
    "qwc2_base_dir": "../qwc-docker/volumes/qwc2"
  },
  "themesConfig": {
    "defaultScales": [100000000, 50000000, 25000000, 10000000, 4000000, 2000000, 1000000, 400000, 200000, 80000, 40000, 20000, 10000, 8000, 6000, 4000, 2000, 1000, 500, 250, 100],
    "defaultPrintGrid": [{"s": 10000000, "x": 1000000, "y": 1000000}, {"s": 1000000, "x": 100000, "y": 100000}, {"s": 100000, "x": 10000, "y": 10000}, {"s": 10000, "x": 1000, "y": 1000}, {"s": 1000, "x": 100, "y": 100}, {"s": 100, "x": 10, "y": 10}],
    "defaultWMSVersion":"1.3.0",
    "defaultBackgroundLayers": [],
    "defaultSearchProviders": ["coordinates"],
    "defaultMapCrs": "EPSG:3857",
    "themes": {
      "items": [
        {
          "title": "Demo",
          "url": "/ows/qwc_demo",
          "default": true,
          "attribution": "Demo attribution",
          "attributionUrl": "https://127.0.0.1/",
          "backgroundLayers": [
            {
              "name": "bluemarble",
              "printLayer": "bluemarble_bg",
              "visibility": true
            },
            {
              "name": "mapnik",
              "printLayer": "osm_bg"
            }
          ],
          "searchProviders": [
            "coordinates",
            "nominatim",
            {
              "provider": "solr",
              "default": [
              ],
              "layers": {
                "countries": "ne_10m_admin_0_countries"
              }
            }
          ],
          "mapCrs": "EPSG:3857",
          "additionalMouseCrs": [],
          "extent": [-1000000, 4000000, 3000000, 8000000],
          "skipEmptyFeatureAttributes": true,
          "printResolutions": [300],
          "thumbnail": "default.jpg"
        },
	{
          "title": "Test WMS",
          "url": "/ows/scan/test",
          "backgroundLayers": [
            {
              "name": "hintergrundkarte_sw"
            }
          ]
        } 
      ],
      "backgroundLayers": [
        {
          "name": "mapnik",
          "title": "Open Street Map",
          "type": "osm",
          "source": "osm",
          "attribution": "OpenStreetMap contributors",
          "attributionUrl": "https://www.openstreetmap.org/copyright",
          "thumbnail": "img/mapthumbs/mapnik.jpg"
        },
        {
          "type": "wmts",
          "url": "http://gibs.earthdata.nasa.gov/wmts/epsg3857/best/BlueMarble_ShadedRelief/default/{TileMatrixSet}/{TileMatrix}/{TileRow}/{TileCol}.jpeg",
          "title": "Blue Marble",
          "name": "bluemarble",
          "tileMatrixPrefix": "",
          "tileMatrixSet": "GoogleMapsCompatible_Level8",
          "originX": -20037508.34278925,
          "originY": 20037508.34278925,
          "projection:": "EPSG:3857",
          "resolutions": [
            156543.03390625,
            78271.516953125,
            39135.7584765625,
            19567.87923828125,
            9783.939619140625,
            4891.9698095703125,
            2445.9849047851562,
            1222.9924523925781
          ],
          "tileSize": [
            256,
            256
          ],
          "thumbnail": "img/mapthumbs/default.jpg"
        },
	{
          "type": "wmts",
          "url": "https://geo.so.ch/api/wmts/1.0.0/ch.so.agi.hintergrundkarte_sw/default/{TileMatrixSet}/{TileMatrix}/{TileRow}/{TileCol}.png",
          "title": "Karte SW",
          "name": "hintergrundkarte_sw",
          "tileMatrixPrefix": "",
          "tileMatrixSet": "2056",
          "originX": 2420000,
          "originY": 1350000,
          "projection": "EPSG:2056",
          "resolutions": [
            4000,
            2000,
            1000,
            500,
            250,
            100,
            50,
            20,
            10,
            5,
            2.5,
            1,
            0.5,
            0.25,
            0.1
          ],
          "tileSize": [
            256,
            256
          ],
          "thumbnail": "img/mapthumbs/hintergrundkarte_sw.png"
        }
      ]
    }
  },
  "services": [
    {
      "name": "mapViewer",
      "generator_config": {
        "qwc2_config": {
          "qwc2_config_file": "../qwc-docker/volumes/config-in/default/config.json",
          "qwc2_index_file": "../qwc-docker/volumes/config-in/default/index.html"
        }
      },
      "config": {
        "qwc2_path": "~/development/config-generator/volumes/qwc2/",
        "auth_service_url": "/auth/",
        "data_service_url": "/api/v1/data/",
        "#document_service_url": "/api/v1/document/",
        "elevation_service_url": "/elevation/",
        "info_service_url": "/api/v1/featureinfo/",
        "legend_service_url": "/api/v1/legend/",
        "mapinfo_service_url": "/api/v1/mapinfo/",
        "ogc_service_url": "/ows/",
        "permalink_service_url": "/api/v1/permalink/",
        "#print_service_url": "/api/v1/print/",
        "search_service_url": "/api/v2/search/",
        "search_data_service_url": "/api/v2/search/geom/"
      }
    }
  ]
}
